{
  "$schema": "https://json-schema.org/draft/2020-12/schema",
  "type": "object",
  "additionalProperties": false,
  "properties": {
    "version": {"const": "mesh.cos.agent-event.v1"},
    "event_id": {"type": "string"},
    "event_type": {"type": "string"},
    "timestamp": {"type": "string"},
    "source": {"type": "string"},
    "actor_agent": {"type": "string"},
    "task_id": {"type": "string"},
    "correlation_id": {"type": "string"},
    "authority_level": {"type": "integer", "minimum": 0, "maximum": 5},
    "result": {"type": "string"},
    "before_state": {"type": ["object", "null"]},
    "after_state": {"type": ["object", "null"]},
    "approval_reference": {"type": ["string", "null"]},
    "evidence_references": {"type": ["array", "null"], "items": {"type": "string"}},
    "error": {"type": ["string", "null"]},
    "idempotency_key": {"type": "string", "minLength": 1}
  },
  "required": ["version","event_id","event_type","timestamp","source","actor_agent","task_id","correlation_id","authority_level","result","before_state","after_state","approval_reference","evidence_references","error","idempotency_key"]
}
