{
  "version": "mesh.cos.agent-event.v1",
  "event_id": "E-1",
  "event_type": "delegated",
  "timestamp": "2026-08-17T12:00:00+00:00",
  "actor_agent": "cos",
  "task_id": "COS-1",
  "correlation_id": "C-1",
  "source": "mesh-cos",
  "before_state": null,
  "after_state": {"status": "ASSIGNED"},
  "authority_level": 3,
  "approval_reference": null,
  "evidence_references": ["delegation://D-1"],
  "result": "ok",
  "error": null,
  "idempotency_key": "idem-1"
}
